{
  "$schema": "https://json-schema.org/draft/2020-12/schema",
  "$id": "https://github.com/tt-a1i/archify/schemas/workflow.schema.json",
  "title": "Archify Workflow Diagram",
  "type": "object",
  "additionalProperties": false,
  "required": [
    "schema_version",
    "diagram_type",
    "meta",
    "lanes",
    "nodes",
    "edges"
  ],
  "properties": {
    "schema_version": {
      "const": 1
    },
    "diagram_type": {
      "const": "workflow"
    },
    "meta": {
      "type": "object",
      "additionalProperties": false,
      "required": [
        "title"
      ],
      "properties": {
        "title": {
          "type": "string",
          "minLength": 1
        },
        "subtitle": {
          "type": "string"
        },
        "output": {
          "type": "string"
        },
        "viewBox": {
          "type": "array",
          "prefixItems": [
            {
              "type": "number",
              "minimum": 700
            },
            {
              "type": "number",
              "minimum": 240
            }
          ],
          "items": false,
          "minItems": 2,
          "maxItems": 2
        }
      }
    },
    "lanes": {
      "type": "array",
      "minItems": 1,
      "items": {
        "type": "object",
        "additionalProperties": false,
        "required": [
          "id",
          "label"
        ],
        "properties": {
          "id": {
            "$ref": "common.schema.json#/$defs/id"
          },
          "label": {
            "type": "string",
            "minLength": 1
          }
        }
      }
    },
    "nodes": {
      "type": "array",
      "minItems": 1,
      "items": {
        "type": "object",
        "additionalProperties": false,
        "required": [
          "id",
          "lane",
          "col",
          "type",
          "label"
        ],
        "properties": {
          "id": {
            "$ref": "common.schema.json#/$defs/id"
          },
          "lane": {
            "$ref": "common.schema.json#/$defs/id"
          },
          "col": {
            "type": "integer",
            "minimum": 0,
            "maximum": 5
          },
          "type": {
            "$ref": "common.schema.json#/$defs/componentType"
          },
          "label": {
            "type": "string",
            "minLength": 1
          },
          "sublabel": {
            "type": "string"
          },
          "tag": {
            "type": "string"
          },
          "width": {
            "type": "number",
            "minimum": 32
          },
          "height": {
            "type": "number",
            "minimum": 32
          },
          "yOffset": {
            "type": "number"
          }
        }
      }
    },
    "edges": {
      "type": "array",
      "items": {
        "type": "object",
        "additionalProperties": false,
        "required": [
          "from",
          "to"
        ],
        "properties": {
          "from": {
            "$ref": "common.schema.json#/$defs/id"
          },
          "to": {
            "$ref": "common.schema.json#/$defs/id"
          },
          "label": {
            "type": "string"
          },
          "variant": {
            "$ref": "common.schema.json#/$defs/variant"
          },
          "fromSide": {
            "$ref": "#/$defs/side"
          },
          "toSide": {
            "$ref": "#/$defs/side"
          },
          "route": {
            "enum": [
              "auto",
              "straight",
              "drop",
              "outside-right",
              "return-left",
              "bottom-channel",
              "up-channel"
            ]
          },
          "via": {
            "type": "array",
            "items": {
              "$ref": "common.schema.json#/$defs/point"
            }
          },
          "labelAt": {
            "$ref": "common.schema.json#/$defs/point"
          },
          "labelDx": {
            "type": "number"
          },
          "labelDy": {
            "type": "number"
          },
          "labelSegment": {
            "type": "integer",
            "minimum": 0
          },
          "channelX": {
            "type": "number"
          },
          "channelY": {
            "type": "number"
          },
          "bias": {
            "type": "number",
            "minimum": 0,
            "maximum": 1
          },
          "width": {
            "type": "number",
            "minimum": 0.5
          }
        }
      }
    },
    "cards": {
      "$ref": "common.schema.json#/$defs/cards"
    }
  },
  "$defs": {
    "side": {
      "enum": [
        "left",
        "right",
        "top",
        "bottom"
      ]
    }
  }
}
